{
  "freeze_version": "2.3.0",
  "campaign_id": "evidence-dag-next-protocol-v2-3",
  "experiment_id": "p1_structural_pro",
  "candidate_configuration_sha256": "526a165558419f9d9c06974be37d05b82ec10219bc28adec647fd5684510ca81",
  "manifest_sha256": "d421cb08108ff685f3c25921d6d3020a44fd413c4951917b06b4bfc63ca6ff35",
  "git_commit": "7771bba92c28879729f7619916927bccc35e0b86",
  "git_clean": true,
  "holdout": {
    "name": "NotApplicable-P1-Diagnostic-Development",
    "already_used": false,
    "ids_sha256": "4f53cda18c2baa0c0354bb5f9a3ecbe5ed12ab4d8e11ba873c2f11161202b945"
  },
  "budgets": {
    "planner_calls_2hop": 1,
    "planner_calls_3hop": 2,
    "planner_calls_4hop": 2,
    "total_llm_calls_4hop": 6,
    "strong_calls": 0
  },
  "versions": {
    "ontology": "2.3.0",
    "graph_matcher": "2.3.0",
    "span_generator": "2.3.0",
    "query_builder": "2.3.0",
    "trigger": "2.3.0",
    "parser": "strict-json-no-repair-v2.3.0",
    "validator": "p1-structural-v2.3.0"
  },
  "exact_command": "set -a; source /root/research/mvp_agentic_rag/.env; set +a; PYTHONPATH=src /root/research/.venv/bin/python scripts/run_evidence_dag_v2_3_p1.py --dataset data/evidence_dag_planner_protocol_v1/diagnostic_60.jsonl --v1-raw analysis/evidence_dag_planner_protocol_v1/planner_diagnostic_raw.jsonl --output-dir analysis/evidence_dag_next_protocol_v2_3/p1_structural_pro --workers 8",
  "environment_sha256": "cdb94b1339c0f404e4a208c93913fcee0e741d95ae7b9c2e1940aca1c5ccd6c2",
  "created_at": "2026-07-18T12:31:45+08:00",
  "fair_comparison_verified": true,
  "gold_policy": {
    "oracle_diagnostic": true,
    "gold_inputs_allowed_in_runtime": true
  }
}
