{
  "freeze_version": "2.3.0",
  "campaign_id": "evidence-dag-next-protocol-v2-3",
  "experiment_id": "p5_r0_gold_query_dense_oracle_extractor",
  "candidate_configuration_sha256": "78ef0b7705661959469b0e3373ac45f656cea7af441deb2bb32a0a1531292872",
  "manifest_sha256": "c844517c634d5eed90947db78ca6b539bdc633a91d4f2e8be6b0d0f1b8fe4df9",
  "git_commit": "37f0cf383f8707febab7ab787c34430ff2c98f54",
  "git_clean": true,
  "holdout": {
    "name": "NotApplicable-P5-R0-Diagnostic-Development",
    "already_used": false,
    "ids_sha256": "4f53cda18c2baa0c0354bb5f9a3ecbe5ed12ab4d8e11ba873c2f11161202b945"
  },
  "budgets": {
    "planner_calls_2hop": 0,
    "planner_calls_3hop": 0,
    "planner_calls_4hop": 0,
    "total_llm_calls_4hop": 0,
    "strong_calls": 0
  },
  "versions": {
    "ontology": "2.3.0",
    "graph_matcher": "2.3.0",
    "span_generator": "2.3.0",
    "query_builder": "gold-bound-template-v1.1b",
    "trigger": "engine-ready-step-v1.1b",
    "parser": "not-applicable-oracle-r0",
    "validator": "oracle-deterministic-r0-v2.3.0"
  },
  "exact_command": "PYTHONPATH=src /root/research/.venv/bin/python scripts/run_evidence_dag_v2_3_p5_r0.py --config configs/evidence_dag_v2_3_p4_diagnostic_dense.yaml --dataset data/evidence_dag_planner_protocol_v1/diagnostic_60.jsonl --corpus data/evidence_dag_planner_protocol_v1/retrieval_corpus.jsonl --output-dir analysis/evidence_dag_next_protocol_v2_3/p5_r0_gold_query_dense_oracle_extractor --top-k 10",
  "environment_sha256": "cdb94b1339c0f404e4a208c93913fcee0e741d95ae7b9c2e1940aca1c5ccd6c2",
  "created_at": "2026-07-18T13:15:32+08:00",
  "fair_comparison_verified": true,
  "gold_policy": {
    "oracle_diagnostic": true,
    "gold_inputs_allowed_in_runtime": true
  }
}
