{
  "freeze_version": "2.3.0",
  "campaign_id": "evidence-dag-next-protocol-v2-3",
  "experiment_id": "p2a_span_candidates",
  "candidate_configuration_sha256": "85c09e46e0cd3087b6476e34b722a91b48d280dc4b824bd7c4e961dc21618b37",
  "manifest_sha256": "19ac6ef9aa7cde5fc7312d9acfce7156e9486a209517d043f7fc9217bf44e8ad",
  "git_commit": "f9934e483a6d989cb78112d62282aaa8f718306c",
  "git_clean": true,
  "holdout": {
    "name": "NotApplicable-P2A-Diagnostic-Development",
    "already_used": false,
    "ids_sha256": "4f53cda18c2baa0c0354bb5f9a3ecbe5ed12ab4d8e11ba873c2f11161202b945"
  },
  "budgets": {
    "planner_calls_2hop": 0,
    "planner_calls_3hop": 0,
    "planner_calls_4hop": 0,
    "total_llm_calls_4hop": 0,
    "strong_calls": 0
  },
  "versions": {
    "ontology": "2.3.0",
    "graph_matcher": "2.3.0",
    "span_generator": "2.3.0",
    "query_builder": "2.3.0",
    "trigger": "2.3.0",
    "parser": "1.1b",
    "validator": "1.1b"
  },
  "exact_command": "PYTHONPATH=src /root/research/.venv/bin/python scripts/run_evidence_dag_v2_3_span_candidates.py --dataset data/evidence_dag_planner_protocol_v1/diagnostic_60.jsonl --output-dir analysis/evidence_dag_next_protocol_v2_3/p2a_span_candidates",
  "environment_sha256": "cdb94b1339c0f404e4a208c93913fcee0e741d95ae7b9c2e1940aca1c5ccd6c2",
  "created_at": "2026-07-18T11:52:30+08:00",
  "fair_comparison_verified": true,
  "gold_policy": {
    "oracle_diagnostic": true,
    "gold_inputs_allowed_in_runtime": true
  }
}
