{
  "freeze_version": "2.3.0",
  "campaign_id": "evidence-dag-next-protocol-v2-3",
  "experiment_id": "p4_retriever_oracle_dense",
  "candidate_configuration_sha256": "34c31fe48caf27bae453bed34c4a70a332f1df0b3a16bb9f4fe48171889b150d",
  "manifest_sha256": "6d6faabeb7960bf407ae0dcd25d1dc2400ffe12f5e4a9ca2761b5ac2f93ebe6f",
  "git_commit": "acd0c00ab322bf5a191d3d498061de08d908d9cf",
  "git_clean": true,
  "holdout": {
    "name": "NotApplicable-P4-Diagnostic-Development",
    "already_used": false,
    "ids_sha256": "4f53cda18c2baa0c0354bb5f9a3ecbe5ed12ab4d8e11ba873c2f11161202b945"
  },
  "budgets": {
    "planner_calls_2hop": 0,
    "planner_calls_3hop": 0,
    "planner_calls_4hop": 0,
    "total_llm_calls_4hop": 0,
    "strong_calls": 0
  },
  "versions": {
    "ontology": "2.3.0",
    "graph_matcher": "2.3.0",
    "span_generator": "2.3.0",
    "query_builder": "gold-teacher-forced-v2.3.0",
    "trigger": "not-applicable-retriever-oracle",
    "parser": "not-applicable-retriever-oracle",
    "validator": "retriever-gate-v2.3.0"
  },
  "exact_command": "PYTHONPATH=src /root/research/.venv/bin/python scripts/run_evidence_dag_v2_3_p4_retriever.py --config configs/evidence_dag_v2_3_p4_diagnostic_dense.yaml --dataset data/evidence_dag_planner_protocol_v1/diagnostic_60.jsonl --corpus data/evidence_dag_planner_protocol_v1/retrieval_corpus.jsonl --output-dir analysis/evidence_dag_next_protocol_v2_3/p4_retriever_oracle_dense --top-k 10",
  "environment_sha256": "cdb94b1339c0f404e4a208c93913fcee0e741d95ae7b9c2e1940aca1c5ccd6c2",
  "created_at": "2026-07-18T13:05:58+08:00",
  "fair_comparison_verified": true,
  "gold_policy": {
    "oracle_diagnostic": true,
    "gold_inputs_allowed_in_runtime": true
  }
}
