{
  "freeze_version": "2.3.0",
  "campaign_id": "evidence-dag-next-protocol-v2-3",
  "experiment_id": "p0b_pro",
  "candidate_configuration_sha256": "5079382fae6dde7e4177b635a3be9bfd912657bf711f9e5a252dc3a703cb46ad",
  "manifest_sha256": "938f3126058822a73dd3c43f5b859b34183afd29fabfd3d2270bb1f4a81e549b",
  "git_commit": "f9934e483a6d989cb78112d62282aaa8f718306c",
  "git_clean": true,
  "holdout": {
    "name": "NotApplicable-Synthetic-Canonical-Payload",
    "already_used": false,
    "ids_sha256": "4f53cda18c2baa0c0354bb5f9a3ecbe5ed12ab4d8e11ba873c2f11161202b945"
  },
  "budgets": {
    "planner_calls_2hop": 0,
    "planner_calls_3hop": 0,
    "planner_calls_4hop": 0,
    "total_llm_calls_4hop": 0,
    "strong_calls": 0
  },
  "versions": {
    "ontology": "2.3.0",
    "graph_matcher": "2.3.0",
    "span_generator": "2.3.0",
    "query_builder": "2.3.0",
    "trigger": "2.3.0",
    "parser": "1.1b",
    "validator": "1.1b"
  },
  "exact_command": "set -a; source /root/research/mvp_agentic_rag/.env; set +a; PYTHONPATH=src /root/research/.venv/bin/python scripts/run_evidence_dag_v2_3_p0.py --experiment p0b --model pro --modes provider_json_schema --schemas topology hop shape slot query validator --count 72 --workers 8 --output-dir analysis/evidence_dag_next_protocol_v2_3/p0b_pro",
  "environment_sha256": "cdb94b1339c0f404e4a208c93913fcee0e741d95ae7b9c2e1940aca1c5ccd6c2",
  "created_at": "2026-07-18T11:52:30+08:00",
  "fair_comparison_verified": true,
  "gold_policy": {
    "oracle_diagnostic": false,
    "gold_inputs_allowed_in_runtime": false
  }
}
